{
  "request_id": "example-ai_workflow_mapper-001",
  "tool_id": "ai_workflow_mapper",
  "input": {
    "description": "Example onboarding workflow from SOP and interview notes.",
    "documents": [
      {
        "filename": "onboarding-sop.txt",
        "content_b64": "aGVsbG8gd29ybGQ=",
        "source_type": "sop"
      }
    ]
  },
  "options": {
    "output_format": "json",
    "mode": "standard"
  },
  "metadata": {
    "submitted_by": "demo-user",
    "synthetic": true
  }
}
