{
  "request_id": "demo-ai_workflow_mapper-001",
  "tool_id": "ai_workflow_mapper",
  "input": {
    "documents": [
      {
        "filename": "minimal.txt",
        "content_b64": "aGVsbG8="
      }
    ]
  },
  "options": {
    "output_format": "json",
    "mode": "standard"
  },
  "metadata": {
    "source": "fixtures/simple",
    "synthetic": true
  }
}
